{"protocol_version":"1.0","request_id":"script-v7","ok":true,"result":{"map_path":"C:\\Users\\hp\\Documents\\Warcraft III\\Hero Team Wars\\builds\\inspection\\HeroTeamWars_MCP_FIXED_v7_A8F8FD88.w3m","map_sha256":"A8F8FD889599143D5581DA14BE41DF2986E7644E742E77A6F40177C520382628","archive_path":"war3map.j","language":"jass","size_bytes":37533,"sha256":"2B227ACEB603E17BD93FEAC15E21037E3742760D7400BC7A0517298B227C6290","source":"// Generated by wc3-map-mcp; do not edit in World Editor.\n// profile: mvp_2arena\n// composer: mcp-jass-composer-2.4\nglobals\n    integer HTW_Round\n    integer HTW_Wave\n    integer HTW_Phase\n    integer HTW_TeamCount\n    integer array HTW_TeamMemberA\n    integer array HTW_TeamMemberB\n    integer array HTW_TeamForce\n    string array HTW_TeamStableId\n    string array HTW_TeamArena\n    boolean array HTW_TeamLiving\n    integer array HTW_TeamDestination\n    integer HTW_ActivePlayerCount\n    integer HTW_ArenaCount\n    rect array HTW_ArenaRect\n    rect HTW_ArenaRectA\n    rect HTW_ArenaRectB\n    integer HTW_LivingTeamCount\n    integer array HTW_LivingTeamIds\n    integer HTW_RouteOffset\n    integer HTW_RouteDestinationTeam\n    boolean HTW_RoutingLocked\n    integer HTW_AdditionalWipeCost\n    integer HTW_AliveHeroCount\n    integer array HTW_ArenaCreepCount\n    group array HTW_ArenaCreepGroup\n    boolean HTW_Bootstrapped\n    group HTW_CleanupGroup\n    integer HTW_CombatSeconds\n    timer HTW_CombatTimer\n    boolean array HTW_HeroAliveByPlayer\n    boolean array HTW_HeroDeathAccountedByPlayer\n    unit array HTW_HeroUnitByPlayer\n    integer HTW_InterestGold\n    integer HTW_LastResolvedWave\n    boolean HTW_MatchOver\n    integer array HTW_PlayerGold\n    integer array HTW_PlayerQueueDestination\n    integer array HTW_PlayerQueueRemaining\n    integer array HTW_PlayerQueueUnitType\n    integer HTW_PreparationSeconds\n    timer HTW_PreparationTimer\n    boolean HTW_ResolutionApplied\n    integer HTW_SendCursor\n    timer HTW_SendTimer\n    integer HTW_SingleDeathCost\n    integer HTW_StartingLives\n    integer array HTW_TeamDeathsThisWave\n    integer array HTW_TeamLives\n    integer HTW_TerminalState\n    boolean HTW_TransitionGuard\n    unit array HTW_WarCampByPlayer\n    boolean HTW_WaveActive\n    integer HTW_WaveReward\n    region HTW_Region_region_0\n    region HTW_Region_region_1\n    region HTW_Region_region_2\n    region HTW_Region_region_3\n    region HTW_Region_region_4\n    region HTW_Region_region_5\n    region HTW_Region_region_6\n    region HTW_Region_region_7\n    region HTW_Region_region_8\n    region HTW_Region_region_9\n    real HTW_Event_round_start\n    real HTW_Event_wave_resolved\nendglobals\n\nfunction HTW_Regions_InitializeProfile takes nothing returns nothing\n    set HTW_ArenaCount = 2\n    set HTW_ArenaRect[1] = Rect(1152., -3072., 2496., -448.)\n    set HTW_ArenaRect[2] = Rect(-2464., -64., -320., 2240.)\n    set HTW_ArenaRectA = HTW_ArenaRect[1]\n    set HTW_ArenaRectB = HTW_ArenaRect[2]\nendfunction\n\nfunction HTW_Teams_ConfigureProfile takes nothing returns nothing\n    set HTW_TeamCount = 2\n    set HTW_LivingTeamCount = 2\n    set HTW_ActivePlayerCount = 4\n    set HTW_TeamStableId[1] = \u0022team_1\u0022\n    set HTW_TeamMemberA[1] = 1\n    set HTW_TeamMemberB[1] = 2\n    set HTW_TeamForce[1] = 1\n    set HTW_TeamArena[1] = \u0022arena_a\u0022\n    set HTW_TeamLiving[1] = true\n    set HTW_LivingTeamIds[1] = 1\n    set HTW_TeamStableId[2] = \u0022team_2\u0022\n    set HTW_TeamMemberA[2] = 3\n    set HTW_TeamMemberB[2] = 4\n    set HTW_TeamForce[2] = 2\n    set HTW_TeamArena[2] = \u0022arena_b\u0022\n    set HTW_TeamLiving[2] = true\n    set HTW_LivingTeamIds[2] = 2\nendfunction\n\n// MCP function: HTW_Tuning_Load (module: config.tuning; config/tuning.j)\nfunction HTW_Tuning_Load takes nothing returns nothing\n    // Centralized MVP tuning.  These values are intentionally source-owned\n    // so a transaction changes one place and the generated map script stays\n    // reproducible.\n    set HTW_StartingLives = 15\n    set HTW_SingleDeathCost = 1\n    set HTW_AdditionalWipeCost = 2\n    set HTW_PreparationSeconds = 35\n    set HTW_CombatSeconds = 90\n    set HTW_WaveReward = 50\n    set HTW_InterestGold = 10\nendfunction\n\n// MCP function: HTW_Objects_Initialize (module: config.objects; config/objects.j)\nfunction HTW_Objects_Initialize takes nothing returns nothing\n    // Standard object rawcodes used by the MCP-native MVP.  Custom object\n    // definitions remain an independent typed map-component concern.\n    // hfoo is the deterministic neutral-hostile base creep, Hpal is the\n    // placeholder hero, and hhou is the visible personal War Camp marker.\nendfunction\n\n// MCP function: HTW_Regions_Initialize (module: config.regions; config/regions.j)\nfunction HTW_Regions_Initialize takes nothing returns nothing\n    // The composer emits this profile-specific registry from typed region\n    // data. MVP and six-team profiles therefore share one runtime path.\n    call HTW_Regions_InitializeProfile()\nendfunction\n\n// MCP function: HTW_Teams_Initialize (module: config.teams; config/teams.j)\nfunction HTW_Teams_Initialize takes nothing returns nothing\n    local integer teamIndex\n    call HTW_Teams_ConfigureProfile()\n    set teamIndex = 1\n    loop\n        exitwhen teamIndex \u003E HTW_TeamCount\n        set HTW_TeamLives[teamIndex] = HTW_StartingLives\n        set teamIndex = teamIndex \u002B 1\n    endloop\nendfunction\n\n// MCP function: HTW_Teams_FindByPlayer (module: config.teams; config/teams.j)\nfunction HTW_Teams_FindByPlayer takes integer playerId returns integer\n    local integer teamIndex\n    set teamIndex = 1\n    loop\n        exitwhen teamIndex \u003E HTW_TeamCount\n        if HTW_TeamMemberA[teamIndex] == playerId or HTW_TeamMemberB[teamIndex] == playerId then\n            return teamIndex\n        endif\n        set teamIndex = teamIndex \u002B 1\n    endloop\n    return 0\nendfunction\n\n// MCP function: HTW_State_Reset (module: core.state; core/state.j)\nfunction HTW_State_Reset takes nothing returns nothing\n    local integer index\n    set HTW_Round = 1\n    set HTW_Wave = 0\n    set HTW_Phase = 1\n    set HTW_RoutingLocked = false\n    set HTW_TransitionGuard = false\n    set HTW_WaveActive = false\n    set HTW_ResolutionApplied = false\n    set HTW_MatchOver = false\n    set HTW_TerminalState = 0\n    set HTW_LastResolvedWave = 0\n    set HTW_SendCursor = 1\n    set HTW_AliveHeroCount = 0\n    set HTW_PreparationTimer = null\n    set HTW_CombatTimer = null\n    set HTW_SendTimer = null\n    set HTW_CleanupGroup = null\n    set index = 1\n    loop\n        exitwhen index \u003E 24\n        set HTW_HeroUnitByPlayer[index] = null\n        set HTW_HeroAliveByPlayer[index] = false\n        set HTW_HeroDeathAccountedByPlayer[index] = false\n        set HTW_WarCampByPlayer[index] = null\n        set HTW_PlayerGold[index] = 0\n        set HTW_PlayerQueueUnitType[index] = 0\n        set HTW_PlayerQueueRemaining[index] = 0\n        set HTW_PlayerQueueDestination[index] = 0\n        set index = index \u002B 1\n    endloop\n    set index = 1\n    loop\n        exitwhen index \u003E HTW_TeamCount\n        set HTW_TeamLives[index] = HTW_StartingLives\n        set HTW_TeamDeathsThisWave[index] = 0\n        set HTW_ArenaCreepGroup[index] = null\n        set HTW_ArenaCreepCount[index] = 0\n        set index = index \u002B 1\n    endloop\nendfunction\n\n// MCP function: HTW_Content_Heroes (module: content.heroes; content/heroes.j)\nfunction HTW_Content_Heroes takes nothing returns nothing\n    // The MVP intentionally uses one standard placeholder hero per active\n    // player.  The hero-selection and custom-object layers remain separate.\nendfunction\n\n// MCP function: HTW_Content_CreateHero (module: content.heroes; content/heroes.j)\nfunction HTW_Content_CreateHero takes integer playerId, real x, real y returns unit\n    return CreateUnit(Player(playerId - 1), \u0027Hpal\u0027, x, y, 270.)\nendfunction\n\n// MCP function: HTW_Content_Abilities (module: content.abilities; content/abilities.j)\nfunction HTW_Content_Abilities takes nothing returns nothing\n    // Standard placeholder hero abilities are intentionally left unchanged in\n    // the MVP.  Custom ability definitions are supplied by typed object data.\nendfunction\n\n// MCP function: HTW_Content_RemoveCreep (module: content.base-waves; content/base-waves.j)\nfunction HTW_Content_RemoveCreep takes nothing returns nothing\n    if GetEnumUnit() != null then\n        call RemoveUnit(GetEnumUnit())\n    endif\nendfunction\n\n// MCP function: HTW_Content_CleanupBaseWaves (module: content.base-waves; content/base-waves.j)\nfunction HTW_Content_CleanupBaseWaves takes nothing returns nothing\n    local integer arenaIndex\n    set arenaIndex = 1\n    loop\n        exitwhen arenaIndex \u003E HTW_ArenaCount\n        if HTW_ArenaCreepGroup[arenaIndex] != null then\n            set HTW_CleanupGroup = HTW_ArenaCreepGroup[arenaIndex]\n            call ForGroup(HTW_CleanupGroup, function HTW_Content_RemoveCreep)\n            call DestroyGroup(HTW_CleanupGroup)\n            set HTW_ArenaCreepGroup[arenaIndex] = null\n            set HTW_ArenaCreepCount[arenaIndex] = 0\n        endif\n        set arenaIndex = arenaIndex \u002B 1\n    endloop\nendfunction\n\n// MCP function: HTW_Economy_GrantPersonalGold (module: systems.economy; systems/economy.j)\nfunction HTW_Economy_GrantPersonalGold takes nothing returns nothing\n    local integer playerId\n    local integer teamIndex\n    set playerId = 1\n    loop\n        exitwhen playerId \u003E HTW_ActivePlayerCount\n        set teamIndex = HTW_Teams_FindByPlayer(playerId)\n        if teamIndex \u003E 0 and HTW_TeamLiving[teamIndex] then\n            set HTW_PlayerGold[playerId] = HTW_PlayerGold[playerId] \u002B HTW_WaveReward \u002B HTW_InterestGold\n        endif\n        set playerId = playerId \u002B 1\n    endloop\nendfunction\n\n//